{
  "archive": "<archive>",
  "archiveSha256": null,
  "bundleDir": "<bundle-dir>",
  "bundleSha256": null,
  "ok": false,
  "schema": "edgp.report.bundle.archive.v1",
  "summary": {
    "bytes": 0,
    "files": 0,
    "verificationFailures": 1
  },
  "verification": {
    "bundleDir": "<bundle-dir>",
    "bundleSha256": null,
    "failures": [
      {
        "code": "archiveMissing",
        "message": "Archive file is missing",
        "path": "<archive>"
      }
    ],
    "manifest": "manifest.json",
    "ok": false,
    "schema": "edgp.report.bundle.verification.v1",
    "summary": {
      "failures": 1,
      "reports": 0
    }
  }
}
